{
    "id": "numberstream",
    "metadata": {
        "name": "Number Stream",
        "version": "0.0.1",
        "description": "package for generating and manipulating streams of numbers"
    },
    "executor": "python",
    "dependencies": [],
    "configuration": {
        "classname": "numberstream_configuration.NumberstreamConfiguration"
    },
    "node_types": {
        "number_input_node": {
            "metadata": {
                "name": "Input Number Node",
                "description": "Input a number"
            },
            "output_ports": {
                "data_out": {
                    "link_type": "numberstream:number"
                }
            },
            "classname": "nodes.number_input_node.NumberInputNode"
        },
        "sum_node": {
            "metadata": {
                "name": "Number Sum",
                "description": "Sum any input number(s) received"
            },
            "input_ports": {
                "data_in": {
                    "link_type": "numberstream:number"
                }
            },
            "output_ports": {
                "data_out": {
                    "link_type": "numberstream:number"
                }
            },
            "classname": "nodes.sum_node.SumNode"
        },
         "number_display_node": {
            "metadata": {
                "name": "Number Display",
                "description": "Display any received number(s)"
            },
            "input_ports": {
                "data_in": {
                    "link_type": "numberstream:number",
                    "allow_multiple_connections": false
                }
            },
            "output_ports": {
            },
            "classname": "nodes.number_display_node.NumberDisplayNode"
        }
    },
    "link_types": {
        "number": {
            "metadata": {
                "name": "Number",
                "description": "Carry a single number"
            }
        }
    }
}